{
  "$schema":"https://json-schema.org/draft/2020-12/schema","$id":"https://ubuddy.invalid/schemas/cp-rir-d2-realized-path-proof-v0.json","type":"object","additionalProperties":false,
  "required":["$schema","schemaVersion","status","caseAlias","pathId","proofKind","issuer","sources","payload","signedPayloadDigest","signature","verificationStatus","implementationStatus"],
  "properties":{"$schema":{"const":"ubuddy-cp-rir-d2-realized-path-proof-v0.schema.json"},"schemaVersion":{"const":"cp-rir/d2-realized-path-proof/v0"},"status":{"const":"illustrative_v0_draft"},"caseAlias":{"type":"string","minLength":1},"pathId":{"type":"string","minLength":1},"proofKind":{"const":"SIGNED_RUNTIME_PATH_ATTESTATION"},"issuer":{"type":"string","minLength":1},"sources":{"type":"object","additionalProperties":false,"required":["runtimeCatalog","canonicalSuite","externalWitness","recoveryManifest"],"properties":{"runtimeCatalog":{"const":"ubuddy-cp-rir-d2-runtime-sink-transcript-v0.input.example.json"},"canonicalSuite":{"const":"ubuddy-cp-rir-d2-canonical-suite-v0.input.example.json"},"externalWitness":{"const":"ubuddy-cp-rir-d2-external-branch-witness-v0.input.example.json"},"recoveryManifest":{"const":"ubuddy-cp-rir-d2-recovery-fsm-manifest-v0.input.example.json"}}},"payload":{"type":"object","additionalProperties":false,"required":["caseAlias","branchId","pathId","stepIndex","transitionId","nonce","sequence","transcriptDigest"],"properties":{"caseAlias":{"type":"string","minLength":1},"branchId":{"type":"string","minLength":1},"pathId":{"type":"string","minLength":1},"stepIndex":{"type":"integer","minimum":1},"transitionId":{"type":"string","minLength":1},"nonce":{"type":"string","minLength":8},"sequence":{"type":"integer","minimum":0},"transcriptDigest":{"type":"string","pattern":"^[a-f0-9]{64}$"}}},"signedPayloadDigest":{"type":"string","pattern":"^[a-f0-9]{64}$"},"signature":{"const":"NOT_IMPLEMENTED"},"verificationStatus":{"const":"NOT_IMPLEMENTED"},"implementationStatus":{"const":"planned/unverified"}}
}
